SLNo,InstitutionName,Address,Code, InstitutionType,ContactNumber,,
1048,Sambram Academi of Management Studies,Vidhyaranyapura,C-20616,Degree/ Professional,80 65903382 / 23643618 / 23640612,,
1049,Sampurna Montfort B Ed College,Indiranagar,C-20860,professional,080 – 25284050 /25283320,,
1050,Samruddhi PU & Degree College (Pethanahalli Gate),Pethanahalli Gate,NEW-56,Degree/ Professional,080-29716416,,
,,"No. 5,8, Murugesh Mudaliar Road,",,,,,
1051,SAM'S College Of Management Studies,,BMTC-123,Degree/ Professional,9886244376/080-41634200,,
,,"Frazer Town, Bengaluru-05.",,,,,
1052,Samvaad College of Speech and Hearing,Bangalore,C-21217,Degree/ Professional,080 – 65351150 / 51,,
1053,Sanjay,Bangalore,C-40077,Medical,080 26564516,,
1054,Sanjay Gandhi college of Education,"Cholanagar, R.T Nagar",C-21028,Degree/ Professional,"80-23545552, 080-65373781, 080–23339377",,
1055,Sanjay Gandhi Institute of Trauma & Orthopaedics Co,Byrasandra Jayanagar East,M-34,Professional/ Medical,080-26564516,,
1056,Sankara College of Optometry,Bangalore,C-40094,professional,"080 40984633,",8951623390,
1057,Sapthagiri College of Engineering (Bagalagunte),Bangalore,C-1359,Technical,"080 2837 2800,28 372801, 28372802, 9900072632",,
,,,,Page 11,,,
,,,college list,,,,
1058,Sapthagiri Institute of Medical Sciences and research centreBangalore,,C-53296,Medical,"080-23323011, 23130583",,
1059,Sardar Vallabai Patel First Grade College (Sarjapur,,),C-20713,Degree/ Professional,"(080) 27823067/ 27823232, 9448535383",
1060,Sarojini College of Nursing,,C-40418,professional,"080 32987884, 09341239299",,
1061,Sarojini School of Nursing,,S-4261,professional,"080500 46002, 09341239299, 9886822717",,
1062,Sarvodaya College of Education,,C-21176,Degree/ Professional,080-23114753,,
1063,Sarvodaya College of Nursing,,C-40584,professional,"(080)42180022 & (080)42170022,","09844074946, 09448227132",
1064,Sarvodaya First Grade College,,C-20657,Degree/ Professional,"9901481284, 08023427927",,
1065,Sarvodaya Law College,,C-9788,professional,080-23234970,,
1066,SB College of Education (Yelahanka New Town),,BCU 3422,Degree/ Professional,"080 28567958, 41757157",,
1067,SB College of Hospital Administration,,C-56737,Medical,"080-28567958, 22724325, 41757157, 09742630858",,
1068,SB College of Management Studies (Yelahanka New Tow,,n),C-21151,Degree/ Professional,"080 – 65656262, 41749502, 9742630858",
1069,SB College of Nursing,,C-40348,professional,"28567958, 22724325, 9916408649",,
1070,SB School of Nursing,,S-4235,professional,080-28567958,,
1071,School of Regenerative Medicine,,C-7253,Professional/ Medical,"080 28460671, 28460681",,
1072,SCT College of Education,,C-21207,Degree/ Professional,"080 - 2524 5225, 080 - 2524 6206",,
1073,SCT College of Nursing,,C-40403,professional,"25245225, 25240694, 9844045640",,
1074,SCT Institute of Technology,,C-1375,Technical,080 2524 5225,,
1075,SCT Polytechnic,,S-1398,professional,"25245225, 9448088480",,
1076,SDM Institute of Ayurveda and Hospital,,C-56843,Medical,080 22718025,,
1077,SDS TRC & RGICD College of Nursing,,NEW-31,professional,"9620149374, 080-26608666",,
1078,SEA College of,Science & Commerce,C-21052,Degree/ Professional,080- 25613741/42 / 8065470229,,
1079,SEA College of Education,,C-20939,Degree/ Professional,080 25613741 / 42,,
1080,SEA College of Engineering & Technology,,C-1268,Technical,+91 080 25613741 / 42,,
1081,SEA College of Nursing,,C-40190,professional,+91 080 25613741 / 42,,
1082,SEA ITI,,PU-29000580,professional,"080 - 25613741/42 ,",9448769633,
1083,SEA School of Nursing,,S-4239,professional,"080 25613741, 25613742, 25618697",,
1084,Seribiotech Research Laboratory,Central Silk Board,Ministry of Textile,C-17502,professional,91 80 65379565,
1085,Seshadripuram Institute of Management Studies,,C-55875,Degree/ Professional,080-22955369,,
1086,Seshadripuram Law College,,C-9831,professional,080 22955367/9880340446/9886515666,,
1087,SET Degree College (Sarvodaya Education Trust) (Agr,,ahara Dasarahalli),C-56180,Degree/ Professional,8023157370,
1088,SGR Polytechnic,,S-12005,professional,7829455266,,
1089,Shakuntala Devi International Institute,of Managem,ent Science,C-21218,Degree/ Professional,98447 90333,
,,,,,,,
1090,Shankara College of Optometry,,E-026,professional,7022997733/080 28542727,,
,,,,,,,
,,,,,,,
1091,Shankthiniketan Polytechnic College,,BMTC-104,professional,9844506605/080-7270363,,
,,,,,,,
1092,Shanthi Dhama School of Nursing,,S-14097,professional,"080 2328 6867, 82 9602 5428, 82 9602 5429, 92 9602 5430",,
1093,Shanthini Kethana College,,C-20692,Degree/ Professional,080 - 26484762,,
1094,Shanti Dhama College,,C-20691,Degree/ Professional,"080 23286867,",+91 9902155244,
1095,Shanti Dhama College of Nursing,,C-40295,professional,"82 9602 5428, 82 9602 5429, 92 9602 5430",,
1096,Shantiniketan College of Education,,C-20866,Degree/ Professional,080 - 26484762,,
1097,Shantiniketan Polytechnic College (Ramanagar),,POL-509,professional,9844506605,,
1098,Sharada Vikas Institute of Management Studies,,C-21116,Degree/ Professional,"080 2244 0420, 25733106",,
1099,Sharada Vikas School of Excellence for Law,,C-59664,professional,"080-25730114, 25733106",,
1100,Sharadadevi College of Nursing,,C-40065,professional,"080 32916083, 9845071975",,
1101,Sha-Shib College,,C-20971,Degree/ Professional,"9342660429, 99454 27626",,
1102,Shekar College of Nursing,,C-40426,professional,"080 26663722, 9448041137",,
1103,Shekhar Institute of Nursing,,S-4274,professional,"080- 28429692, 26663722 , 65957265",,
1104,Sheshadhripuram First Grade College,,C-20601,Degree/ Professional,080 – 22955369/71,,
1105,Sheshadripuram Arts,Science & Commerce College,C-21043,Degree/ Professional,"080 2295 5382, 080 – 22955354",,
1106,Sheshadripuram Commerce College,,Road,C-20645,Degree/ Professional,"80 2295 5368, 080 – 22955383",
1107,Sheshadripuram Institute of Commerce & Management,,C-20937,Degree/ Professional,080 – 22955382,,
1108,Sheshdripuram Academy of Busienss Studies,,C-21183,Degree/ Professional,080 – 28488676,,
1109,Shifaa School of Nursing,,S-4275,professional,4000 7300 / 22207660 / 22207662,,
1110,Shree Bhavani School of Nursing,,S-4281,professional,"080 23381091, 23145046, 9886170470",,
1111,Shree Krishna Degree College,,C-57257,Degree/ Professional,080 - 26690799 / 26796020 / 55365825,,
1112,Shri Balaji College of Law (K H B Colony),,NEW-57,Degree/ Professional,8023586865,,
1113,Shri Jagadguru Renukacharya College of Law,,C-9776,professional,8022263468,,
1114,Shri Pillappa College of Engineering,,C-47257,Technical,094495 59227/+91 80 28446727,,
1115,Shri Sharada First Grade College,,C-21057,Degree/ Professional,9243825101,,
1116,Shri Veerabhadraswamy ITI (Vibhuthipura),,PR29000588,professional,"8025237234, 9845797990",,
,,,,,,,
1117,Shri Vidya Vinaya Institute Of Technology,,BMTC-46,Technical,9972209777/ 9742819777,,
,,,,,,,
1118,Shushruti College of Education,,C-21132,Degree/ Professional,080 - 28360671 / 65473805,,
1119,Shushruti College of Nursing,,C-44908,professional,"080 28367032, 9448283560",,
1120,Shushruti Institute of Business Management,,C-21122,Degree/ Professional,080 – 65473806,,
1121,Shushruti School of Nursing,,S-4295,professional,"080 2836 7730, 28367032, 9448226058",,
1122,Shushruti School of Nursing,,S-4296,professional,"(080) 23538053, 23536819, 9844026113",,
1123,Shuttariya College of Education,,C-21003,Degree/ Professional,080 - 23536819 / 23538053,,
1124,Siddaganga College of Management and Science,,C-21045,Degree/ Professional,94498 30811,,
1125,Sidvin School of Business Management,,C-20661,Degree/ Professional,"9448240196, 080-26799571/26698225/288",,
1126,SIET College,,C-56694,Degree/ Professional,"91 818 407 9307 / +91 80 2848 4828 ,",,
1127,Silicon City College (KR Puram),,C-20931,Degree/ Professional,8147093466/ 080 65602259,,
1128,Silicon City College of Management and Commerce,,C-21027,Degree/ Professional,09742006032/ 09980276597,,
1129,Sindhi College of Commerce,,C-20893,Degree/ Professional,080 41178288/ 23637544,,
1130,Sir M Vishveshwaraiah college,,C-20687,Degree/ Professional,080 – 25220215,,
1131,Sir M Visvesvaraya First Grade College(Konena Agrah,,ara),NEW-58,Degree/ Professional,8025229188,
1132,Sir M Visvesvaraya Institute of Technology (Hunasam,,aranahalli),C-1327,Technical,"080 2846 7248, 28477024/25/26",
1133,Sivananda Sarma Memorial RVCollege (SSMRV),,C-21071,Degree/ Professional,080-22453665,,
1134,SJB College of Education,,C-21040,Degree/ Professional,9972442154/ 080 65333381,,
1135,SJB College of Management Studies,,C-21174,Degree/ Professional,080 – 65470359,,
1136,SJB College of Nursing,,C-40104,professional,8065460337,,
1137,SJB Institute of Technology,,C-1271,Technical,-621998.6739,,
1138,SJB School of Architecture & Planning,,C-50033,Technical,080 6450 0177,,
1139,SJB School of Nursing,,S-4241,professional,080 6546 0337,,
1140,SJC Institute of Technology,,C-1320,Technical,8156263181,,
1141,SJES College Education,,C-21224,Degree/ Professional,80 48048988,,
1142,SJES College of Hotel Mangament,,C-21136,Degree/ Professional,080-25611169,,
1143,SJES College of Mangament Studies,,7634 E059,Degree/ Professional,7634 E059,,
1144,SJES College of Nursing,,C-40502,professional,"080 25611169, 25613118, 25613119",,
1145,SJES Polytechnic,,S-10977,professional,9535493980,,
1146,SJES School of Nursing,,S-4242,professional,"080 25611169, 080 6568 4768",,
1147,SJM Polytechnic (Nelamangala),,S-1405,professional,"9008811477, 7353449921",,
1148,SJP First Grade College,,NEW-59,Degree/ Professional,9880331399/9738521278,,
1149,SJR Women College,,C-20845,Degree/ Professional,080-23359474/23303463,,
1150,SJRC Arts,,C-20805,Degree/ Professional,"+91 80-2226 4952, 2225 0245",,
,,,,,,,
1151,Skites Degree College,,BMTC-162,Degree/ Professional,080-28393304/ 7406973304/05,,
,,,,,,,
1152,SKM Teachers College,,C-20600,professional,"080 23477157, 9880271871",,
,,,,,,,
1153,Skybird Aviation,,BMTC-134,professional,9886673876/ 9036011209,,
,,,,,,,
1154,SLN College of Arts Commerce (KR Market),,C-21121,Degree/ Professional,080 26708314,,
1155,SLN First Grade College,,C-50341,Degree/ Professional,080-26708314,,
1156,SLN Teachers Training Instiute,,AS-002,professional,080-26704389,,
1157,Smt Gangamma Hombegowda First Grade College,,C-21127,degree/ Professional,"080-22118134,",,
1158,Smt Kamala Bai Degree College,,C-20676,Degree/ Professional,080 223421012 / 32402657,,
,,,,Page 12,,,
,,,,,,,
1159,Smt Lakshmi Devi College of Nursing,Bangalore,professional,9342874954,,,
1160,Smt Mehras College of Education,Horamavu,Degree/ Professional,"(080) 25426741/ 41634200/ 25484020, Mobile: 9945696360",,,
1161,Smt Mehra's College of Management Studies & Science,Horamavu,Degree/ Professional,"(080) 25426741/ 41634200/ 25484020, Mobile: 9945696360",,,
1162,Smt Nagarathanamma College of Nursing,Bangalore,professional,9980097317,,,
1163,Smt Nagarathnamma School of Nursing,Acharya Post office,professional,9740838403,,,
1164,Smt Nalini Raghunath Rao Degree College (Jigani),Jigani,Degree/ Professional,9902868262,,,
1165,SN Bhat College of Commerce & Business Management,Bangalore,Degree/ Professional,080 26422627,,,
1166,Sneha College of Nursing,Bangalore,professional,"080-25430306 , 25436736",,,
1167,Sofia College of Nursing,Bangalore,professional,080-65737800,,,
1168,Sophia Degree College (K G halli),"Shampura Main Road, KG halli",Degree/ Professional,8069999924,,,
1169,Soundarya Institute of Management & Science,Nagasandra,Degree/ Professional,"080 28390024, 64503637",,,
1170,South Asia Institute of Advanced Christian Studies,Kothanur,Degree/ Professional,(80) 28465649 / 28465344,,,
1171,Spurthy College of Nursing,Bangalore,professional,"91 80 27827777,80 27827779, +91 8970999998",,,
1172,Spurthy College of Science & Management Studies,"Marasur Gate, Anekal",Degree/ Professional,"080 27827777, 8970999998",,,
1173,Spurthy Institute of Nursing,Bangalore,professional,"080 27827777,","27827779, 8970999998, 095385 40707",,
1174,SRC Institute of Business Management,Bangalore,Degree/ Professional,"9620770199, 8022261148",,,
1175,Sree Balaji Degree College,Hanumanthanagar,Degree/ Professional,080 26507292,,,
1176,Sree Cauvery Management College (Kodihalli HAL 2nd,Kodihalli HAL 2nd Stage,C-20921,Degree/ Professional,08025210011 / 25200733,,
1177,Sree Omkar College of Commerce & Management,Bagalur Road,Degree/ Professional,080-28478662,,,
1178,Sree Srinivasa Industrial Training Centre,"Yelachenahalli, Kanakapura Main Road",professional,8026662897,,,
,,"No. 121, Yelachenahalli, Near",,,,,
1179,Sree Srinivasa ITI,,professional,080-26662897/ 9880486167,,,
,,"Govardhan Garden, Bengaluru-62",,,,,
1180,Sree Venkateshwara School of Nursing,Bangalore,professional,"099024 33338, 08028363999,08028363888",,,
1181,Sri,Bangalore,Degree/ Professional,080-23493096,,,
,,"No. 22, Gangusa Layout, Kalkere",,,,,
1182,Sri,"Main Road, Ramurthynagara,",professional,9243448127,,,
,,Bengaluru-16.,,,,,
1183,Sri Adi Chunchanagiri College of Business Managemen,Vijayanagar,C-21048,Degree/ Professional,080 41270033,,
1184,Sri Aravinda Industrial Training Center (Sanjaynaga,Sanjaynagar Doddaballapur,PR-29001232,professional,9886155830,,
1185,Sri Aurbindo First Grade College for Women,Mahalakshmipuram,Degree/ Professional,"080 23492449, 23490843",,,
1186,Sri Ayyappan ITI (Jayamahal),Jayamahal,professional,"080 23433008, 9886964437",,,
,,"No. 37, Sri Mata Sadguru Krupa",,,,,
1187,Sri Banashankari ITI,"Building, Parvathapura Road,",professional,,,,
,,Devanahalli - 562110,,,,,
1188,Sri Banashankari ITI,Devanahalli,professional,9611290415,,,
1189,Sri Basavaraja Swamy College of Nursing,Bangalore,professional,+91 81478 87526 / 94825 09200,,,
1190,Sri Basaveshwara First Grade College For Women(Nela,Nelamangala,C-51639,Degree/ Professional,"080 27722511, 9964972856",,
1191,Sri Chamarajendra Samskrita College,Bangalore,Degree/ Professional,080-2670 1303,,,
1192,Sri Devaraj Urs Institute of Management,Kodigehalli Doddaballapura,Degree/ Professional,"080 27404215, 9663397471",,,
1193,Sri Jayachamarajendra(Govt)Polytechnic,Bangalore,professional,"8022343031, 9481474515",,,
1194,Sri Jayadeva Institute of Physiotherapy (Gurappanap,Gurappanapalya,NEW-7,Professional/ Medical,"080 22977281, 305",,
1195,Sri K Shivaram Industrial Training Centre (Ramamurt,Ramamurthynagar,PR-29000560,professional,9243448127,,
1196,Sri Kalabhyraveshwara Swamy College of Nursing,Bangalore,professional,"080-23185229, 23185231",,,
1197,Sri Kalabyreshwara Ayurvedic Medical College,Bangalore,Medical,080-23407806/ 91-9449831620,,,
1198,Sri Kongadiayappa College,Doddaballapura,Degree/ Professional,9845185052,,,
1199,Sri Kongadiayappa College of Education,Bangalore,Degree/ Professional,9845185052,,,
1200,Sri Krishana Institute of Technology,Bangalore,Technical,"080 6579 0005, +91-80-28392221",,,
1201,Sri Krishna College of Education B Ed(Devanahalli),Bychapura,APSO-2069,professional,9980416087,,
1202,Sri Krishna College of Nursing,Bangalore,professional,080 - 283922219620315133,,,
1203,Sri Krishna Degree College,BSK 3rd Stage,Degree/ Professional,080–26690799/26796020/55365825,,,
1204,Sri Krishna ITI (Devanahalli),Devanahalli,professional,9945222132,,,
1205,Sri Krishna Polytechnic,"Chikkabellandur, Sarjapura Road",professional,"080-28439384, 9844504290",,,
1206,Sri Krishna Polytechnic (Chikkabanavara),Chikkabanavara,professional,"8065717393, 9845143615",,,
1207,Sri Krishna Rukmini College of Nursing,Bangalore,professional,9740804541/,080-64500286,,
1208,Sri Lakshmi College of Management & Science,Bangalore,Degree/ Professional,"080 23585832, 9538499988",,,
,,"Konena Agrahara, Old Airport",,,,,
1209,Sri M Visvesvaraya First Grade College,,Degree/ Professional,25229188/ 2522226,,,
,,"Road, Bengaluru-17.",,,,,
1210,Sri Mangilal Sundar Bai Gotawat Jain College of Art,Indiranagar IInd stage,C-21113,Degree/ Professional,080 25250843/ 26623701,,
,,"Opp. Mission Hospital, T.G Extn.",,,,,
1211,Sri Maruthi Degree College,,Degree/ Professional,9008470068,,,
,,"Hoskote, Bengaluru-114.",,,,,
1212,Sri Nirvanaswamy College of Nursing,Bangalore,professional,N/A,,,
1213,Sri Raghavendra,Bangalore,professional,9742162365,,,
1214,Sri Raghavendra College of Education,Chikkabanavara,Degree/ Professional,080 65790005,,,
1215,Sri Raghavendra College of Pharmacy,Bangalore,professional,9742162365,,,
1216,Sri Raghavendra ITI (Basaveshwaranagar),Basaveshwaranagar,professional,9886629502,,,
1217,Sri Rajiv Gandhi College of Dental Sciences,Bangalore,Medical,"80-23339377, 23631145, 23335985, 23435559",,,
1218,Sri Ramakrishna College of Nursing,Bangalore,professional,8041219977,,,
1219,Sri Revana Siddeshwara Institute,Bangalore,Technical,"099728 56004,","080-33647779 ( ext-1), 8088722111",,
1220,Sri Rudreshwara Samskrit College,Bangalore,Degree/ Professional,"98446 60756, 97428 24076",,,
1221,Sri S Nijalingappa Medical Education Centre (Shivaj,Shivajinagar,KA-01 PMC(10),Medical,080 25360590,,
1222,Sri Sadguru Sainath Degree College,Koodlu village,Degree/ Professional,080 60015717/ 09343706195,,,
1223,Sri Sai College for Women,Rajajinagar II Stage,Degree/ Professional,080 23324716,,,
1224,Sri Sai Ram Degree College,Bangalore,Degree/ Professional,080 41255114,,,
1225,Sri Sairam College of Engineering,Bangalore,Technical,"080 2663 5623 /22455361, 9113053745",,,
1226,Sri Sarvajna college of Education,Bangalore,Degree/ Professional,0802-3111242,,,
1227,Sri Sathya Narayana ITI (Herohalli),"Herohalli,Magadi Road",professional,9886629502,,,
1228,Sri Sathya Sai College,Bangalore,Degree/ Professional,"080 28004600, 28411500",,,
1229,Sri Sathya Sai Institute of Higher Medical Sciences,Bangalore,Degree/ Professional,"080 28004600, 28411500",,,
1230,Sri Sathya Sai Institute of Medical Sciences,Bangalore,Professional/ Medical,"080 28004600, 28411500",,,
,,"No. 150, Kempegowda Naraga,",,,,,
1231,Sri Sathyanarayana ITI,"Herohalli North, Vishwanidam",professional,9886629502,,,
,,"Post, Magadi Road, Bengaluru-91.",,,,,
1232,Sri Shanthini College of Nursing,Bangalore,professional,9845109568,,,
1233,Sri Shanthini School of Nursing,Bangalore,professional,9845109568,,,
,,"Chairman M. Narasimhaiah Layout,",,,,,
1234,Sri Sharada First Grade College,"Byatarayanapura, Mysore Road,",Degree/ Professional,8026743707,,,
,,Bengaluru-26.,,,,,
1235,Sri Sharada Nursing College (Uttarahalli),Uttarahalli,professional,8026390826,,,
,,"Behing Govt. Hospital, Choki",,,,,
1236,Sri Shivayogi Muneshwaraswamy ITI,"Mutt, BM Road, Bidadi, Bengaluru-",professional,9916080448,,,
,,562117,,,,,
1237,Sri Siddagana Arts and Commerce College,Nelamangala,Degree/ Professional,080 27101204,,,
,,"Near KSRTC Bus Stand, BB Road,",,,,,
1238,Sri Siddaramaiah Law College,"Vapasandra, Chikkballapura-",professional,9980828277/ 08156-272030,,,
,,562101,,,,,
1239,Sri Soubhagaya Lalitha College of Nursing,Bangalore,professional,9886170470,,,
1240,Sri Sri Ayurvedic Medical College,Bangalore,Medical,"8095723044, 7760635804",,,
1241,Sri Vagdevi School of Nursing,Bangalore,professional,"080-28390580, 9902623080",,,
,,"Vibhuthipura, Veerasimhasana",,,,,
1242,Sri Veerabhadraswamy ITI,"Samstana Mutt, Marathalli,",professional,9845797990/ 080-25237234,,,
,,Bengaluru-37,,,,,
1243,Sri Venkataraju Institute of Management,KR Layout JP Nagar 6th Phase,Degree/ Professional,"080 41722112, 41722907",,,
1244,Sri Venkataraju Institute of Tech,Bangalore,Technical,9986633773,,,
1245,Sri Venkateshwara College of Education,"Maruthinagar, Madivala",Degree/ Professional,"9886447657, 41106363",,,
1246,Sri Venkateshwara College of Engineering,Bangalore,Technical,"080 3271 7536, 08032717535,08028477460,9916775988",,,
1247,Sri Venkateshwara College of Nursing (Peenya),Bangalore,professional,91-80-4127 2515 / 9880514523,,,
,,,Page 13,,,,
,,,,,,,
1248,Sri Venkateshwara College of Science & Management StudiesK.R. Puram,,Degree/ Professional,080–65468144,,,
1249,Sri Venkateshwara Dental College & Hospital (Banner,Bannerughatta,D-008,Medical,"080-27803521, 27803522, 9986284320",,
1250,Sri Venkateshwara First Grade College,Maruthinagar,Degree/ Professional,9886447657/ 080 - 41106363 / 25634984,,,
1251,Sri Venkateshwara Institute of Nursing Sciences (Ho,Bangalore,C-44870,professional,"09448275555, 985030169",,
1252,Sri Venkateshwara Polytechnic (Bannerghatta),Bangalore,professional,9448186982,,,
1253,Sri Venkateshwara School of Nursing,Bangalore,professional,"099024 33338, 08028363999,08028363888",,,
1254,Sri Vidya ITI,"W.O.C Road, Rajajinagara",professional,8023302626,,,
1255,Sri Vidya Vinayaka Institute of Technology (Vinayak,"Vinayakanagar, Dodda Alada Mara",NEW-61,Technical,9972209777,,
1256,Sri Vinayaka Para Medical College,K R Puram,professional,"8025618353, 9481215924",,,
1257,Sri Vishnu College of Nursing,Bangalore,professional,91 - 96636 30666 /,80 2839 4135,,
1258,Sri Vishnu School of Nursing,Bangalore,professional,"9663630666, 8028394135",,,
1259,Srilakshmi College of Nursing,Bangalore,professional,"09449226807 , 9845227354",,,
1260,Srilakshmi College of Nursing (Sunkadakatte),Sunkadakattae,professional,"080 23585832, 9538499988",,,
1261,Srinidhi College of Nursing (Hommadevanahalli),Bangalore,professional,080-23329909/ 8880090611,,,
,,"N0. 33/1, Byarathi Ext. Hennur-",,,,,
1262,Srinivasa College of Pharmacy,"Bagluru Main Road, Kottanur Post,",professional,080-28443064/ 9880462926,,,
,,Bengaluru-77,,,,,
,,"CA Site No. 21,5th Phase, KHB",,,,,
1263,Srishti Institute of Arts Degree and Technology,"Colony, Yelahanka New Town",Degree/ Professional,080-49000800/ 49000801/ 9972072418,,,
,,Bengaluru-64.,,,,,
,,"No. 784, Ring Road, 7th Block, 2nd",,,,,
1264,Srishti School of Business,"Phase, Banashankari 3rd State,",Degree/ Professional,8147764992,,,
,,Bengaluru-85.,,,,,
1265,SRK School of Nursing,Bangalore,professional,"080 23435325, 9448227179",,,
1266,SRN Adarsh Degree College (Chamarajpet),Chamarajpet,Degree/ Professional,080-26677100,,,
1267,Srushti College,Karthik Nagar Marathahalli,Degree/ Professional,"9152769466, 9740388405, 9664645111",,,
1268,SS College of Arts & Commerce,Chamarajpet,Degree/ Professional,"26672669, 9740009995",,,
1269,SSK Degree College (Chandra Layout),Chandra Layout,Degree/ Professional,080-23397700,,,
1270,SSR College of Science &,Vijayanagar,Degree/ Professional,9448884488/9620929000/ 080 – 23107336 /23113811,,,
1271,SSR College of Science & Management Studies,Kylasanahalli KR Puram,Degree/ Professional,080 28443576,,,
1272,St Aloysius Degree College (Coxtown),Cox Town,Degree/ Professional,080 – 25466393,,,
1273,St Annes,Halasur,Degree/ Professional,080 25544454,,,
1274,St Annes Frist Grade College For Women (Ramamurthy,Ramamurthynagar,C-20836,Degree/ Professional,8025651079,,
1275,St Anns First Grade College for Women,Millers Road,Degree/ Professional,080 22383421,,,
1276,St Claret College,Sharadambangar,Degree/ Professional,"080 28383175, 23455151",,,
1277,St Francis B Ed College,Koramangala,professional,080 25531076/ 25500123/ 25501030,,,
1278,St Francis de Sales College (PG) Huskur Gate,"Hebbagodi, Electronic city",Degree/ Professional,9591923435,,,
1279,St George College of Management,Banasawavdi OMBR Layout,Degree/ Professional,080 – 25450193 / 25450194,,,
1280,St George College of Nursing,Bangalore,professional,9845 062 687/ 9742 575 774,,,
1281,St George School of Nursing,Bangalore,professional,080 2545 0193,,,
1282,St Hopkins College of Management (Adugodi),Adugodi,Degree/ Professional,8022113435,,,
1283,St Hopkins International College (Kalyana Nagara),Bangalore,Degree/ Professional,9986057316,,,
1284,St Jeromes First Grade College (Carmelaram),"Ambedkar Nagar, Mullur",Degree/ Professional,"080-28439536, 9886893331",,,
1285,St John’s College of Pharmacy,Bangalore,professional,9180-23300668,,,
1286,St John’s College of Physiotherapy,Bangalore,Professional/ Medical,28566115,,,
1287,St John's College,Vijayanagara,Degree/ Professional,N/A,,,
1288,St John's College of Nursing,Bangalore,professional,080 - 25520780,,,
1289,St John's Institute of Nursing,Bangalore,professional,91-080-23210044,,,
1290,St John's Medical College & Hospital,Bangalore,Medical,"080 2206 5008, +91 080 22064052",,,
1291,St John's Medical College (Madivala Checkpost),"Johnnagar, Sarjapura Road",Professional/ Medical,8049466006,,,
1292,St John's Medical College (RDT),Bangalore,Professional/ Medical,91 080 22064052,,,
1293,St John's Medical College,Bangalore,Professional/ Medical,91 80 4946 6029; 91 80 4946 6030; 91 80 4946 6031,,,
1294,St John's School of Nursing,Bangalore,professional,"080 2206 5008, +91 080 22064052",,,
1295,St Joseph Nursing School,Madiwala,professional,"080 65739223, 9845065769",,,
1296,St Josephs Arts & Science College,Lalbhag Rd,Degree/ Professional,080 2227 4079/ 2221 1429,,,
1297,St Josephs College of Commerce,Museum Road,Degree/ Professional,080 25360644/46,,,
1298,St Josephs College of Law,Bangalore,professional,"080-2222 3352, 2222 3353",,,
,,"No. 28/1, Primerose Road,",,,,,
1299,St Joseph's Institute of Management,,professional,080-25597781,,,
,,Bengaluru-25,,,,,
1300,St Martha's Hospital School of Nursing,Bangalore,professional,"080 2229 3669, 22293956, 9449121971",,,
1301,St Mary School of Nursing,Bangalore,professional,080- 60503737,,,
1302,St Mary’s Institute of Nursing,Bangalore,professional,080- 60503737,,,
1303,St Marys School Of Nursing,Bangalore,professional,090085 28855,,,
1304,St Patricks Industrial Training Centre (Brigade Roa,Brigade Road,PU-29000181,professional,9342996738,,
1305,St Pauls College (Nelagadaranahalli),Nelaghadarenahalli,Degree/ Professional,9167088531,,,
,,"No. 1, 2nd Main Road, BDA",,,,,
1306,St Paul's College of Education,"Layout, Prashanthnagar,",Degree/ Professional,9035116429/ 8050850737,,,
,,"Vijayanagara West, Bengaluru-79.",,,,,
,,"Kotaganahalli, Bikkanahalli Road,",,,,,
1307,St Philomena's First Grade College,,Degree/ Professional,7996926756/ 9743261992,,,
,,"Sarjpur, Bengaluru-562125",,,,,
1308,St Philomena's Hospital,Bangalore,Medical,080 4016 4433,,,
